[
  {
    "id": "langmuir_adsorption_kernel_v1",
    "domain": "adsorption",
    "input_schema": "K: float, P: float",
    "output_schema": "coverage: float",
    "io_typing": {
      "inputs": [
        { "name": "K", "numeric_kind": "nonnegative_float" },
        { "name": "P", "numeric_kind": "nonnegative_float" }
      ],
      "outputs": [{ "name": "coverage", "numeric_kind": "float" }]
    },
    "semantic_contract": "Implements Langmuir isotherm theta = K*P / (1 + K*P); nonnegative K and P yield coverage in [0,1].",
    "unit_constraints": [
      "K dimensionless or 1/pressure",
      "P pressure",
      "coverage dimensionless"
    ],
    "linked_theorem_cards": ["langmuir_1918_adsorption_card_001"],
    "test_status": "tested",
    "contract_v1": {
      "units": {
        "inputs": {
          "K": "dimensionless or 1/pressure",
          "P": "pressure"
        },
        "outputs": {
          "coverage": "dimensionless"
        }
      },
      "domains": {
        "inputs": {
          "K": "K >= 0",
          "P": "P >= 0"
        },
        "outputs": {
          "coverage": "0 <= coverage <= 1"
        }
      },
      "exceptional_cases": [],
      "approximation_regimes": [],
      "tolerances": {
        "absolute_error": 0.000001,
        "relative_error": 0.000001
      },
      "witness_type": "numerically_witnessed",
      "obligations": {
        "expected_linked_theorem_cards": ["langmuir_1918_adsorption_card_001"],
        "satisfied_linked_theorem_cards": ["langmuir_1918_adsorption_card_001"],
        "unsatisfied_linked_theorem_cards": []
      }
    }
  }
]
