[
  {
    "id": "langmuir_adsorption_kernel_v1",
    "domain": "adsorption",
    "input_schema": "K: float, P: float",
    "output_schema": "coverage: float",
    "io_typing": {
      "inputs": [
        { "name": "K", "numeric_kind": "nonnegative_float" },
        { "name": "P", "numeric_kind": "nonnegative_float" }
      ],
      "outputs": [{ "name": "coverage", "numeric_kind": "float" }]
    },
    "semantic_contract": "Implements Langmuir isotherm theta = K*P / (1 + K*P); nonnegative K and P yield coverage in [0,1].",
    "linked_theorem_cards": ["langmuir_1918_adsorption_card_001"],
    "unit_constraints": ["K dimensionless or 1/pressure", "P pressure", "coverage dimensionless"],
    "contract_v1": {
      "units": {
        "inputs": {
          "K": "dimensionless or 1/pressure",
          "P": "pressure"
        },
        "outputs": {
          "coverage": "dimensionless"
        }
      },
      "domains": {
        "inputs": {
          "K": "K >= 0",
          "P": "P >= 0"
        },
        "outputs": {
          "coverage": "0 <= coverage <= 1"
        }
      },
      "exceptional_cases": [],
      "approximation_regimes": [],
      "tolerances": {
        "absolute_error": 0.000001,
        "relative_error": 0.000001
      },
      "witness_type": "numerically_witnessed",
      "obligations": {
        "expected_linked_theorem_cards": ["langmuir_1918_adsorption_card_001"],
        "satisfied_linked_theorem_cards": ["langmuir_1918_adsorption_card_001"],
        "unsatisfied_linked_theorem_cards": []
      }
    },
    "test_status": "tested"
  },
  {
    "id": "freundlich_adsorption_kernel_v1",
    "domain": "adsorption",
    "input_schema": "k: float, c: float, n: float",
    "output_schema": "amount: float",
    "io_typing": {
      "inputs": [
        { "name": "k", "numeric_kind": "positive_float" },
        { "name": "c", "numeric_kind": "positive_float" },
        { "name": "n", "numeric_kind": "float" }
      ],
      "outputs": [{ "name": "amount", "numeric_kind": "float" }]
    },
    "semantic_contract": "Implements Freundlich isotherm amount = k * c^(1/n); c > 0, n != 0 in typical use.",
    "linked_theorem_cards": ["freundlich_1906_adsorption_card_001"],
    "unit_constraints": ["k dimensioned", "c concentration", "n dimensionless", "amount adsorbed per mass"],
    "contract_v1": {
      "units": {
        "inputs": {
          "k": "dimensioned",
          "c": "concentration",
          "n": "dimensionless"
        },
        "outputs": {
          "amount": "adsorbed per mass"
        }
      },
      "domains": {
        "inputs": {
          "k": "k > 0",
          "c": "c > 0",
          "n": "n != 0"
        },
        "outputs": {
          "amount": "amount >= 0"
        }
      },
      "exceptional_cases": [],
      "approximation_regimes": [],
      "tolerances": {
        "absolute_error": 0.000001,
        "relative_error": 0.000001
      },
      "witness_type": "numerically_witnessed",
      "obligations": {
        "expected_linked_theorem_cards": ["freundlich_1906_adsorption_card_001"],
        "satisfied_linked_theorem_cards": ["freundlich_1906_adsorption_card_001"],
        "unsatisfied_linked_theorem_cards": []
      }
    },
    "test_status": "tested"
  }
]
